{
  "schema": "sentinel-admission/draft-1",
  "action": "rule.promote",
  "intentDigest": "sha256:1111111111111111111111111111111111111111111111111111111111111111",
  "requestedBy": {
    "principal": "human",
    "channel": "owner-cli"
  },
  "policyRevision": "sha256:3333333333333333333333333333333333333333333333333333333333333333",
  "verdicts": {
    "policy": {
      "allowed": true,
      "asked": true,
      "reasonCode": "sentinel.admission.granted",
      "detail": "x"
    },
    "capability": {
      "allowed": true,
      "asked": true,
      "reasonCode": "sentinel.admission.capabilityAvailable",
      "detail": "x"
    },
    "credential": {
      "allowed": true,
      "asked": true,
      "reasonCode": "sentinel.admission.credentialLocalOnly",
      "detail": "x",
      "basis": "local-only"
    }
  },
  "outcome": "admitted",
  "receipt": "sha256:4444444444444444444444444444444444444444444444444444444444444444",
  "decidedAt": "2026-10-22T10:00:00.000000000Z"
}
