{
  "schema": "sentinel-admission/draft-1",
  "action": "paid.admit",
  "intentDigest": "sha256:1111111111111111111111111111111111111111111111111111111111111111",
  "requestedBy": {
    "principal": "agent",
    "channel": "mcp"
  },
  "policyRevision": "sha256:3333333333333333333333333333333333333333333333333333333333333333",
  "verdicts": {
    "policy": {
      "allowed": true,
      "asked": true,
      "reasonCode": "sentinel.admission.granted",
      "detail": "x"
    },
    "capability": {
      "allowed": true,
      "asked": true,
      "reasonCode": "sentinel.admission.capabilityAvailable",
      "detail": "x"
    },
    "credential": {
      "allowed": true,
      "asked": true,
      "reasonCode": "sentinel.admission.credentialScoped",
      "detail": "x",
      "basis": "keychain-scope"
    }
  },
  "outcome": "awaiting-confirmation",
  "receipt": null,
  "decidedAt": "2026-10-22T10:00:00.000000000Z"
}
